{
  "visual_plan_id": "VP001",
  "asset_bible": {
    "style_guide": {
      "realism_target": "technical_realistic",
      "lighting": "Soft natural indoor daylight, matching the canonical smartphone capture profile; believable household shadows and restrained HDR.",
      "camera_style": "Realistic modern-smartphone documentation photography, 26 mm-equivalent main-camera look, stable geometry across multi-view references.",
      "environment": "Ordinary modern home kitchen / utility area with neutral wall, light floor and restrained cabinetry.",
      "color_notes": "Neutral household colors; refrigerator remains dark charcoal matte/satin coated metal.",
      "forbidden_style_traits": [
        "hyper-polished CGI",
        "neon rim lighting",
        "excessive depth of field",
        "perfectly symmetrical showroom staging",
        "unmotivated environment changes"
      ]
    },
    "entities": [
      {
        "entity_id": "fridge_01",
        "name": "Canonical refrigerator",
        "role": "primary",
        "canonical_description": "Dark charcoal freestanding two-door top-freezer refrigerator, designed as one believable mass-produced household appliance and locked first through an AI-generated multi-view reference pack.",
        "visual_properties": {
          "body_color": "dark charcoal",
          "door_layout": "top-freezer two-door",
          "finish": "matte/satin coated metal",
          "environment": "ordinary home kitchen",
          "baseline_view": "multi-view reference pack; rear-left/rear-right 45° preferred for rear-heat scenes"
        },
        "invariant_features": [
          "dark charcoal matte/satin body",
          "same top-freezer/two-door geometry",
          "upper freezer door smaller than lower fresh-food door",
          "thin brushed-silver horizontal divider trim",
          "same recessed vertical left-edge handle geometry",
          "same cabinet width-height-depth proportions",
          "same feet, panel seams, edge radii and door thickness across views"
        ],
        "allowed_variations": [
          "select a different approved A0 reference view for the target camera direction",
          "crop and zoom",
          "transparent cutaway overlays",
          "technical labels and arrows",
          "warm-surface highlight",
          "diagram overlay while preserving silhouette"
        ],
        "forbidden_variations": [
          "change to white or stainless-steel finish",
          "change to French-door, side-by-side or bottom-freezer layout",
          "change door count, divider position, handle design or cabinet proportions",
          "replace with a different refrigerator model",
          "invent hidden technical components merely for visual convenience",
          "use CGI/showroom styling that conflicts with the smartphone-realistic reference pack"
        ],
        "anchor_asset_ids": [
          "A0",
          "A1"
        ],
        "continuity_constraints": [
          "A0 is the canonical geometry/identity source of truth and must pass Multi-View QA before scene generation.",
          "A1 must be generated from the approved A0 rear-oriented reference views.",
          "All later physical refrigerator scenes must use approved A0 view(s) plus A1/approved derivatives as applicable.",
          "Technical abstractions preserve the recognizable fridge_01 silhouette."
        ]
      }
    ],
    "assets": [
      {
        "asset_id": "A0",
        "status": "planned",
        "asset_kind": "reference_pack",
        "entity_ids": [
          "fridge_01"
        ],
        "purpose": "AI-generated canonical multi-view reference board that locks product identity and exterior geometry.",
        "source_uri": null,
        "canonical_view": "front, front-left 45°, front-right 45°, left, right, rear-left 45°, rear-right 45°, rear",
        "notes": "Generated from MVP1 with the smartphone PhotoCaptureSpec; no real product photo is required."
      },
      {
        "asset_id": "A1",
        "status": "planned",
        "asset_kind": "generated_image",
        "entity_ids": [
          "fridge_01"
        ],
        "purpose": "Scene S1 anchor generated from approved A0 rear reference views.",
        "source_uri": null,
        "canonical_view": "rear three-quarter",
        "notes": "Must derive from approved A0; not a real-photo acquisition step."
      },
      {
        "asset_id": "A2",
        "status": "planned",
        "asset_kind": "reference_image",
        "entity_ids": [
          "fridge_01"
        ],
        "purpose": "Cutaway derivative showing interior-to-exterior heat movement.",
        "source_uri": null,
        "canonical_view": "same angle as A1 with transparent cutaway",
        "notes": "Must derive from A1."
      },
      {
        "asset_id": "A3",
        "status": "planned",
        "asset_kind": "diagram",
        "entity_ids": [
          "fridge_01"
        ],
        "purpose": "Simplified refrigeration loop over the same refrigerator silhouette.",
        "source_uri": null,
        "canonical_view": "locked cutaway",
        "notes": "Evaporator, compressor, condenser path."
      },
      {
        "asset_id": "A4",
        "status": "planned",
        "asset_kind": "programmatic_asset",
        "entity_ids": [
          "fridge_01"
        ],
        "purpose": "Animated condenser heat-rejection overlay.",
        "source_uri": null,
        "canonical_view": "close heat-rejection area",
        "notes": "SVG/Remotion arrows over A3/A1 context."
      },
      {
        "asset_id": "A5",
        "status": "planned",
        "asset_kind": "diagram",
        "entity_ids": [
          "fridge_01"
        ],
        "purpose": "Rear-versus-side heat-rejection comparison using the same canonical refrigerator.",
        "source_uri": null,
        "canonical_view": "controlled split/rotation comparison",
        "notes": "Do not introduce a second unrelated refrigerator."
      },
      {
        "asset_id": "A6",
        "status": "planned",
        "asset_kind": "reference_image",
        "entity_ids": [
          "fridge_01"
        ],
        "purpose": "Return to the canonical exterior with subtle warm-surface highlight.",
        "source_uri": null,
        "canonical_view": "rear three-quarter",
        "notes": "Derived directly from A1."
      },
      {
        "asset_id": "A7",
        "status": "planned",
        "asset_kind": "programmatic_asset",
        "entity_ids": [
          "fridge_01"
        ],
        "purpose": "Final summary heat path from interior to exterior.",
        "source_uri": null,
        "canonical_view": "wide summary view",
        "notes": "Overlay on A6/A1."
      }
    ]
  },
  "routes": [
    {
      "scene_id": "S1",
      "route": "generated_image",
      "source_strategy": "new_generated_anchor",
      "rationale": "Generate the first scene anchor from the approved AI-generated A0 multi-view reference pack so the appliance identity is already locked across front/side/rear geometry.",
      "input_asset_ids": [
        "A0"
      ],
      "planned_output_asset_ids": [
        "A1"
      ],
      "required_tools": [
        "ChatGPT Image",
        "approved A0 reference views"
      ],
      "regeneration_policy": "derive_from_anchor",
      "reality_notes": [
        "A1 must inherit fridge_01 geometry and dark-charcoal material from A0.",
        "Use the approved rear-left/rear-right/rear A0 views to constrain the rear-three-quarter scene."
      ]
    },
    {
      "scene_id": "S2",
      "route": "reference_edit",
      "source_strategy": "derived_edit",
      "rationale": "The same refrigerator must remain recognizable while the interior heat path is revealed.",
      "input_asset_ids": [
        "A0",
        "A1"
      ],
      "planned_output_asset_ids": [
        "A2"
      ],
      "required_tools": [
        "image edit",
        "mask/cutaway overlay"
      ],
      "regeneration_policy": "derive_from_anchor",
      "reality_notes": [
        "Preserve exterior geometry and camera perspective.",
        "Use the closest approved A0 view(s) to cross-check geometry while preserving A1 scene continuity."
      ]
    },
    {
      "scene_id": "S3",
      "route": "technical_diagram",
      "source_strategy": "diagram_from_anchor",
      "rationale": "The refrigerant path is invisible and is better explained as a controlled diagram tied to the same refrigerator.",
      "input_asset_ids": [
        "A1",
        "A2"
      ],
      "planned_output_asset_ids": [
        "A3"
      ],
      "required_tools": [
        "SVG",
        "diagram labels"
      ],
      "regeneration_policy": "derive_from_anchor",
      "reality_notes": [
        "Keep the fridge silhouette as spatial reference."
      ]
    },
    {
      "scene_id": "S4",
      "route": "programmatic_animation",
      "source_strategy": "hybrid",
      "rationale": "Heat leaving the condenser should be animated deterministically with arrows and highlights.",
      "input_asset_ids": [
        "A3"
      ],
      "planned_output_asset_ids": [
        "A4"
      ],
      "required_tools": [
        "Remotion",
        "SVG"
      ],
      "regeneration_policy": "derive_from_anchor",
      "reality_notes": [
        "Use restrained heat visualization rather than flames or glowing CGI."
      ]
    },
    {
      "scene_id": "S5",
      "route": "reference_edit",
      "source_strategy": "derived_edit",
      "rationale": "The design comparison should reuse fridge_01 and overlay alternate heat-rejection locations instead of showing unrelated appliances.",
      "input_asset_ids": [
        "A0",
        "A1"
      ],
      "planned_output_asset_ids": [
        "A5"
      ],
      "required_tools": [
        "image edit",
        "SVG overlay"
      ],
      "regeneration_policy": "derive_from_anchor",
      "reality_notes": [